[
  {
    "title": "Getting Started",
    "url": "https://docs.tokenpak.ai/QUICKSTART/",
    "section": "starter",
    "description": "Set up TokenPak and inspect your first request receipt, including zero savings."
  },
  {
    "title": "Installation",
    "url": "https://docs.tokenpak.ai/installation/",
    "section": "starter",
    "description": "pip install options, OS notes, troubleshooting install failures."
  },
  {
    "title": "Claude Code guide",
    "url": "https://docs.tokenpak.ai/guides/claude-code/",
    "section": "starter",
    "description": "Route Claude Code through TokenPak with one environment variable."
  },
  {
    "title": "OpenAI SDK guide",
    "url": "https://docs.tokenpak.ai/guides/openai-sdk/",
    "section": "starter",
    "description": "Point the OpenAI Python SDK at TokenPak with OPENAI_BASE_URL."
  },
  {
    "title": "Anthropic SDK guide",
    "url": "https://docs.tokenpak.ai/guides/anthropic-sdk/",
    "section": "starter",
    "description": "Point the Anthropic Python SDK at TokenPak with ANTHROPIC_BASE_URL."
  },
  {
    "title": "Cline guide",
    "url": "https://docs.tokenpak.ai/guides/cline/",
    "section": "starter",
    "description": "Compatibility target, not yet independently verified. Expected setup for Cline with a custom compatible base URL."
  },
  {
    "title": "Codex CLI guide",
    "url": "https://docs.tokenpak.ai/guides/codex/",
    "section": "starter",
    "description": "Route Codex CLI's ChatGPT-subscription traffic through TokenPak with OPENAI_BASE_URL."
  },
  {
    "title": "Cursor guide",
    "url": "https://docs.tokenpak.ai/guides/cursor/",
    "section": "starter",
    "description": "Compatibility target, not yet independently verified. Expected setup for Cursor with an OpenAI-compatible base URL."
  },
  {
    "title": "Gemini CLI guide",
    "url": "https://docs.tokenpak.ai/guides/gemini-cli/",
    "section": "starter",
    "description": "Route Gemini CLI through TokenPak with GOOGLE_GEMINI_BASE_URL."
  },
  {
    "title": "Aider guide",
    "url": "https://docs.tokenpak.ai/guides/aider/",
    "section": "starter",
    "description": "Compatibility target, not yet independently verified. Expected setup for Aider with --openai-api-base and openai/<model>."
  },
  {
    "title": "Continue.dev guide",
    "url": "https://docs.tokenpak.ai/guides/continue/",
    "section": "starter",
    "description": "Compatibility target, not yet independently verified. Expected setup for Continue.dev with ~/.continue/config.json."
  },
  {
    "title": "CLI Reference",
    "url": "https://docs.tokenpak.ai/cli/",
    "section": "reference",
    "description": "Every tokenpak verb, flag, and exit code."
  },
  {
    "title": "Architecture",
    "url": "https://docs.tokenpak.ai/architecture/",
    "section": "reference",
    "description": "Proxy-centered model; three planes; 18 subsystems at a glance."
  },
  {
    "title": "Troubleshooting",
    "url": "https://docs.tokenpak.ai/troubleshooting/",
    "section": "support",
    "description": "Common symptoms and the fixes that work."
  }
]
